{
  "games": [
    {
      "game_key": "nfl.2024",
      "name": "NFL Football",
      "code": "nfl",
      "season": 2024,
      "type": "full"
    },
    {
      "game_key": "nba.2024",
      "name": "NBA Basketball", 
      "code": "nba",
      "season": 2024,
      "type": "full"
    },
    {
      "game_key": "mlb.2024",
      "name": "MLB Baseball",
      "code": "mlb", 
      "season": 2024,
      "type": "full"
    }
  ],
  "leagues": {
    "nfl.2024": [
      {
        "league_key": "423.l.12345",
        "name": "My NFL League",
        "num_teams": 12,
        "current_week": 15,
        "game_key": "nfl.2024"
      }
    ],
    "nba.2024": [
      {
        "league_key": "428.l.67890",
        "name": "My NBA League", 
        "num_teams": 10,
        "current_week": 12,
        "game_key": "nba.2024"
      }
    ]
  },
  "teams": {
    "423.l.12345": [
      {
        "team_key": "423.l.12345.t.1",
        "name": "Team Alpha",
        "waiver_priority": 5,
        "league_key": "423.l.12345"
      },
      {
        "team_key": "423.l.12345.t.2", 
        "name": "Team Beta",
        "waiver_priority": 3,
        "league_key": "423.l.12345"
      },
      {
        "team_key": "423.l.12345.t.3",
        "name": "Team Gamma",
        "waiver_priority": 8,
        "league_key": "423.l.12345"
      }
    ]
  },
  "players": {
    "nfl.2024": [
      {
        "player_key": "423.p.33445",
        "full_name": "Dak Prescott",
        "position": "QB",
        "team": "DAL",
        "game_key": "nfl.2024"
      },
      {
        "player_key": "423.p.33446",
        "full_name": "Ezekiel Elliott", 
        "position": "RB",
        "team": "DAL",
        "game_key": "nfl.2024"
      },
      {
        "player_key": "423.p.33447",
        "full_name": "CeeDee Lamb",
        "position": "WR", 
        "team": "DAL",
        "game_key": "nfl.2024"
      }
    ],
    "nba.2024": [
      {
        "player_key": "428.p.55667",
        "full_name": "LeBron James",
        "position": "SF",
        "team": "LAL",
        "game_key": "nba.2024"
      },
      {
        "player_key": "428.p.55668", 
        "full_name": "Anthony Davis",
        "position": "PF",
        "team": "LAL",
        "game_key": "nba.2024"
      }
    ]
  },
  "rosters": {
    "423.l.12345.t.1": [
      {
        "player_key": "423.p.33445",
        "full_name": "Dak Prescott",
        "position": "QB",
        "team": "DAL"
      },
      {
        "player_key": "423.p.33447",
        "full_name": "CeeDee Lamb", 
        "position": "WR",
        "team": "DAL"
      }
    ]
  }
}